Health,Mind,Preventative care,2,1,Development,,,1068,1069,Calm sleep music,Learn about how listening to music can get you to sleep.,"Struggling to sleep? Maybe listening to music can help you drift off to sleep, learn about using music to help improve your sleep.","Music is a powerful art form that can offer a simple way to improve sleep hygiene, improving your ability to fall asleep quickly, sleep deeply and awake feeling more rested.",Visit site,All,,,,,,0-99,"Male, Female, Non-Conforming","Working, Retired, Not-Working",https://onlinelibrary.wiley.com/doi/abs/10.1111/j.1365-2648.2009.04982.x,,Yellow Brick Cinema,Content writer,https://www.youtube.com/watch?v=6dZHGDzFXmY&list=PLQkQfzsIUwRYwVveZoqE-HUxv84Zknrsi,Online,N/A,Free,No,None,,,N/A,N/A,N/A,Quarterly,Gap,Psychology Today,Content writer,https://www.psychologytoday.com/us/blog/sleep-newzzz/201812/the-many-health-and-sleep-benefits-music,Online,N/A,Free,No,None,,,1.7,https://uk.trustpilot.com/review/www.psychologytoday.com,N/A,Yearly,,Sleep Foundation,Charity,https://www.sleepfoundation.org/noise-and-sleep/music,Online,N/A,Free,No,None,,,3.3,https://uk.trustpilot.com/review/sleepfoundation.org,N/A,Yearly,gap,SleepHub,Company,https://www.awin1.com/cread.php?awinmid=26097&awinaffid=1198638&ued=https%3A%2F%2Fwww.sleephub.com%2F,Online,N/A,Paid,Approved,AWIN=26097,,,N/A,N/A,N/A,Quarterly,
Health,Mind,Preventative care,2,1,Maintenance,,,1069,,Music and sleep,8 hours of sleep music for a better night's sleep.,"Listen to this playlist of calming relaxing music, to help you have a better night's sleep and create a better sleep habit.",,Sign up,All,daily,1 month,28,Yellow Brick Cinema,https://www.youtube.com/watch?v=6dZHGDzFXmY&list=PLQkQfzsIUwRYwVveZoqE-HUxv84Zknrsi,0-99,"Male, Female, Non-Conforming","Working, Retired, Not-Working",https://onlinelibrary.wiley.com/doi/abs/10.1111/j.1365-2648.2009.04982.x,,Yellow Brick Cinema,Content writer,https://www.youtube.com/watch?v=6dZHGDzFXmY&list=PLQkQfzsIUwRYwVveZoqE-HUxv84Zknrsi,Online,N/A,Free,No,None,,,N/A,N/A,N/A,Quarterly,Gap,,,,,,,,,,,,,,,,,,,,,,,,,,,,,,gap,,,,,,,,,,,,,,,
Health,Mind,Preventative care,2,1,Development,,,1070,1071,Quality sleep,Learn how to improve the quality of your sleep.,"Among the most common problems related to aging is sleep quality, with over half of adults reporting symptoms of insomnia. Learn how to improve your sleep quality for a better night’s sleep.","While duration is key, sleep quality is often overlooked. Even if you get your 8 hours of sleep, you may still wake up feeling lethargic and tired, relying on coffee, and wishing you could go back to sleep. If so, there's a good chance your sleep quality needs some work.",Read,All,,,,,,0-99,"Male, Female, Non-Conforming","Working, Retired, Not-Working",https://academic.oup.com/sleep/article/33/4/509/2454611,,Sleep Foundation,Charity,https://www.sleepfoundation.org/sleep-hygiene/healthy-sleep-tips,Online,N/A,Free,No,None,,,3.8,https://uk.trustpilot.com/review/sleepfoundation.org,N/A,Yearly,Gap,BSLM,Charity,https://bslm.org.uk/the-importance-of-good-quality-sleep/,Online,N/A,Free,No,None,,,N/A,N/A,N/A,Quarterly,,National Sleep Foundation,Charity,https://www.thensf.org/what-is-sleep-quality/,Online,N/A,Free,No,None,,,N/A,N/A,N/A,Quarterly,gap,SleepHub,Company,https://www.awin1.com/cread.php?awinmid=26097&awinaffid=1198638&ued=https%3A%2F%2Fwww.sleephub.com%2F,Online,N/A,Paid,Approved,AWIN=26097,,,N/A,N/A,N/A,Quarterly,
Health,Mind,Preventative care,2,1,Maintenance,,,1071,,Boost sleep quality,Start improving the quality of your sleep.,"Start working on improving your sleep quality, build a healthy habit of good night's restful sleep.",,Sign up,All,weekly,6 months,24,Sleep Hubs,https://www.awin1.com/cread.php?awinmid=18997&awinaffid=1198638&ued=https%3A%2F%2Fsleephubs.com%2F,0-99,"Male, Female, Non-Conforming","Working, Retired, Not-Working",https://academic.oup.com/sleep/article/33/4/509/2454611,,Sleep Hubs,Company,https://www.awin1.com/cread.php?awinmid=18997&awinaffid=1198638&ued=https%3A%2F%2Fsleephubs.com%2F,Online,N/A,Paid,Approved,AWIN= 18997,,,https://yogainternational.com/article/view/yoga-over-50/,https://uk.trustpilot.com/review/www.sleephubs.com,N/A,Yearly,Gap,,,,,,,,,,,,,,,,,,,,,,,,,,,,,,gap,,,,,,,,,,,,,,,
Community,Expand,Giving back,5,1,Development,"Give Back,Fundraising",Y,1072,1073,Fundraising,Learn about fundraising.,Learn about fundraising for a charity that's close to your heart or neighbourhood and start making a difference.,"Fundraising to support charities is of great value, helping charities to continue their important work. It's also a great way to meet new people and learn new skills.",Read,All,,,,,,0-99,"Male, Female, Non-Conforming","Working, Retired, Not-Working",,,easyfundraising,Charity,https://www.easyfundraising.org.uk/fundraising-ideas/,Online,N/A,Free,No,None,,,4.6,https://uk.trustpilot.com/review/www.easyfundraising.org.uk,N/A,Yearly,Gap,Uk Government,Government dept,https://www.gov.uk/guidance/fundraising-legally-and-responsibly,Online,N/A,Free,No,None,,,1.3,https://uk.trustpilot.com/review/www.gov.uk,N/A,Yearly,,Eden Project Communities,Company,https://www.edenprojectcommunities.com/ideas/seven-ways-to-fundraise-for-your-community,Online,N/A,Free,No,None,,,N/A,N/A,N/A,Quarterly,gap,The Fundraising Regulator,Charity,https://www.fundraisingregulator.org.uk/guidance/topics/community-fundraising-and-events,Online,N/A,Free,No,None,,,N/A,N/A,N/A,Quarterly,
Community,Expand,Giving back,5,1,Maintenance,,,1073,,Start fundraising,Start fundraising for your chosen cause.,Start planning regular fundraisers and make a difference.,,Sign up,All,every 6 months,3 years,6,easyfundraising,https://www.easyfundraising.org.uk/fundraising-ideas/,0-99,"Male, Female, Non-Conforming","Working, Retired, Not-Working",,,easyfundraising,Charity,https://www.easyfundraising.org.uk/fundraising-ideas/,Online,N/A,Free,No,None,,,4.6,https://uk.trustpilot.com/review/www.easyfundraising.org.uk,N/A,Yearly,Gap,,,,,,,,,,,,,,,,,,,,,,,,,,,,,,gap,,,,,,,,,,,,,,,
Community,Expand,Inner circle,1,2,Development,,,1074,1075,Relationship tips,Understand the importance of working on your relationship.,"Learn about the importance of working on, and improving your relationship with your partner, as well as tips to use to benefit all relationships.","Social connections help to influence our long-term health in ways every bit as powerful as adequate sleep and a good diet. Studies have shown that people who have social support from family, friends, and their community are happier, have fewer health problems, and live longer.",Read,All,,,,,,0-99,"Male, Female, Non-Conforming","Working, Retired, Not-Working",https://academic.oup.com/gerontologist/article/38/5/618/593836,,Psych Central,Content writer,https://psychcentral.com/lib/simple-steps-to-improve-your-relationship#general-strategies,Online,N/A,Free,No,None,,,N/A,N/A,N/A,Quarterly,Gap,HelpGuide.org,Content writer,https://www.helpguide.org/articles/relationships-communication/relationship-help.htm,Online,N/A,Free,No,None,,,N/A,N/A,N/A,Quarterly,G,Verywell Mind,Content writer,https://www.verywellmind.com/7-surprising-ways-to-make-your-relationship-better-5094212,Online,N/A,Free,No,None,,,N/A,N/A,N/A,Quarterly,gap,12 Magical Dates,Company,https://www.12magicaldates.com/reignite-marriage-relationship?r_done=1,Online,N/A,Paid,Pending,AWIN=48129,,,N/A,N/A,N/A,Quarterly,
Community,Expand,Inner circle,1,2,Maintenance,,,1075,,Relationship tips,Start working on improving your relationship.,Start implementing these relationship tips to help your relationship with your partner.,,Sign up,All,weekly,6 months,24,Verywell Mind,https://www.verywellmind.com/7-surprising-ways-to-make-your-relationship-better-5094212,0-99,"Male, Female, Non-Conforming","Working, Retired, Not-Working",https://academic.oup.com/gerontologist/article/38/5/618/593836,,Verywell Mind,Content writer,https://www.verywellmind.com/7-surprising-ways-to-make-your-relationship-better-5094212,Online,N/A,Free,No,None,,,N/A,N/A,N/A,Quarterly,Gap,,,,,,,,,,,,,,,,,,,,,,,,,,,,,,gap,,,,,,,,,,,,,,,
Community,Contribute,Inner circle,1,3,Development,,,1076,1077,Marriage guidance,Learn about the benefits of marriage guidance.,Learn about improving your marriage (or significant relationship) to help you have a healthy supportive relationship.,"A good supportive relationship has many health benefits, but sometimes we need a bit of help getting back to a happy relationship, consider seeking marriage guidance and counselling to put your relationship back on track.",Visit site,UK,,,,,,0-99,"Male, Female, Non-Conforming","Working, Retired, Not-Working",https://academic.oup.com/gerontologist/article/38/5/618/593836,,Relate,Charity,https://www.relate.org.uk/,Online,N/A,Paid,??,None,,,2.1,https://uk.trustpilot.com/review/www.relate.org.uk,N/A,Yearly,Gap,Marriage,Content writer,https://www.marriage.com/advice/counseling/4-benefits-of-marriage-counseling/,Online,N/A,Free,No,None,,,3.9,https://uk.trustpilot.com/review/www.marriage.com,N/A,Yearly,,Marriage,Content writer,https://www.marriage.com/advice/relationship/best-marriage-advice/,Online,N/A,Free,No,None,,,3.9,https://uk.trustpilot.com/review/www.marriage.com,N/A,Yearly,gap,12 Magical Dates,Company,https://www.12magicaldates.com/reignite-marriage-relationship?r_done=1,Online,N/A,Paid,Pending,AWIN=48129,,,N/A,N/A,N/A,Yearly,
Community,Contribute,Inner circle,1,3,Maintenance,,,1077,,Marriage guidance,Start marriage guidance.,Seek marriage or relationship guidance to help get your relationship back on track.,,Sign up,All,weekly,6 months,24,Relate,https://www.relate.org.uk/,0-99,"Male, Female, Non-Conforming","Working, Retired, Not-Working",https://academic.oup.com/gerontologist/article/38/5/618/593836,,Relate,Charity,https://www.relate.org.uk/,Online,N/A,Paid,??,None,,,2.1,https://uk.trustpilot.com/review/www.relate.org.uk,N/A,Yearly,Gap,,,,,,,,,,,,,,,,,,,,,,,,,,,,,,gap,,,,,,,,,,,,,,,
Health,Body,Diagnostic,3,1,Development,Disease Mgt,Y,1078,1079,Be body aware,Learn the importance of listening to your body.,"Learn why you should listen to your body, they know exactly what they need, and learning how to listen will be better for your health and wellbeing.","Being able to learn to listen and understand your body is an essential part of living a healthy life. This fundamental thing is as important as having a healthy mindset and should be a part of the daily routine, the same as exercise, nutrition, and good life choices.",Read,All,,,,,,0-99,"Male, Female, Non-Conforming","Working, Retired, Not-Working",https://www.tandfonline.com/doi/full/10.1080/21679169.2020.1845792,,Medium,Content writer,https://medium.com/live-your-life-on-purpose/learn-to-listen-to-your-body-3-useful-techniques-f135699d280f,Online,N/A,Free,No,None,,,1.9,https://uk.trustpilot.com/review/medium.com,N/A,6 monthly,Gap,Web MD,Company,https://www.webmd.com/a-to-z-guides/ss/slideshow-listen-to-body,Online,N/A,Free,No,None,,,3.5,https://uk.trustpilot.com/review/www.webmd.com,N/A,Yearly,,Amelia Freer,Content writer,https://ameliafreer.com/article/the-importance-of-listening-to-your-body/,Online,N/A,Free,No,None,,,N/A,N/A,N/A,Quarterly,gap,,,,,,,,,,,,,,,
Health,Body,Diagnostic,3,1,Maintenance,,,1079,,Listen to your body,Get listening to what your body is telling you.,Start listening to your body not only to create a healthy habit but also put yourself first.,,Sign up,All,weekly,6 months,24,WebMD,https://www.webmd.com/a-to-z-guides/ss/slideshow-listen-to-body,0-99,"Male, Female, Non-Conforming","Working, Retired, Not-Working",https://www.tandfonline.com/doi/full/10.1080/21679169.2020.1845792,,WebMD,Company,https://www.webmd.com/a-to-z-guides/ss/slideshow-listen-to-body,Online,N/A,Free,No,None,,,3.5,https://uk.trustpilot.com/review/www.webmd.com,N/A,Yearly,Gap,,,,,,,,,,,,,,,G,,,,,,,,,,,,,,,gap,,,,,,,,,,,,,,,
Health,Nutrition,Healthy Basics,1,3,Development,"Nutrition,Water",Y,1080,1081,Drinking water,The importance of staying hydrated.,"Drinking water does more than just quench your thirst, it's essential to keep your body functioning properly and feeling healthy. Discover the many benefits of staying hydrated.","Water is essential for your body's functioning, from removing waste products in urine, to lubricating your joints, transporting nutrients around your body, and controlling your temperature. It can even help make your skin look good.",Read,All,,,,,,0-99,"Male, Female, Non-Conforming","Working, Retired, Not-Working",https://onlinelibrary.wiley.com/doi/abs/10.1111/j.1466-7657.2004.00224.x,,Plant Nanny,Company,https://plantnanny.app/,Online,N/A,Free,??,None,,,N/A,N/A,N/A,Quarterly,Gap,Healthline,Content writer,https://www.healthline.com/health/food-nutrition/why-is-water-important,Online,N/A,Free,No,None,,,1.5,https://uk.trustpilot.com/review/www.healthline.com,N/A,Yearly,,Medical News Today,Content writer,https://www.medicalnewstoday.com/articles/290814,Online,N/A,Free,No,None,,,2,https://uk.trustpilot.com/review/www.medicalnewstoday.com,N/A,Yearly,gap,ZeroWater,Company,https://www.awin1.com/cread.php?awinmid=30649&awinaffid=1198638&ued=https%3A%2F%2Fzerowater.co.uk%2F,Online,N/A,Paid,Approved,AWIN=30649,,,4.5,https://uk.trustpilot.com/review/zerowater.co.uk,N/A,Yearly,
Health,Nutrition,Healthy Basics,1,3,Maintenance,,,1081,,Drink more water,Monitor and track your water intake.,Start tracking your water intake daily to help create a healthy hydrated habit.,,Sign up,All,daily,2 months,56,Plant Nanny,https://plantnanny.app/,0-99,"Male, Female, Non-Conforming","Working, Retired, Not-Working",https://onlinelibrary.wiley.com/doi/abs/10.1111/j.1466-7657.2004.00224.x,,Plant Nanny,Company,https://plantnanny.app/,Online,N/A,Free,??,None,,,N/A,N/A,N/A,Quarterly,Gap,,,,,,,,,,,,,,,,,,,,,,,,,,,,,,gap,,,,,,,,,,,,,,,
Health,Exercise,Healthy Basics,1,2,Development,,,1082,1083,Breathing exercises,Read about the benefits of breathing exercises.,"Breathing is something you do tens of thousands of times each day, without even thinking about it. Learn about using breathing techniques to improve your respiratory health.","Breathing exercises not only improve your respiratory health, but they can also help build strength and stamina, as well as improve general mood and wellbeing.",Read,All,,,,,,0-45,"Male, Female, Non-Conforming","Working, Retired, Not-Working","https://www.scielo.br/j/clin/a/ZRYgFMXwkPD6WRhJtLzqB3c/abstract/?lang=en, https://europepmc.org/article/med/3292262",,Verywell Mind,Content writer,https://www.verywellmind.com/the-benefits-of-deep-breathing-5208001,Online,N/A,Free,No,None,,,N/A,N/A,N/A,Quarterly,Gap,Healthline,Content writer,https://www.healthline.com/health/how-to-increase-lung-capacity,Online,N/A,Free,No,None,,,1.5,https://uk.trustpilot.com/review/www.healthline.com,N/A,Yearly,,Harvard,Company,https://www.health.harvard.edu/staying-healthy/breathing-your-way-to-better-health,Online,N/A,Free,No,None,,,N/A,N/A,N/A,Quarterly,gap,,,,,,,,,,,,,,,
Health,Exercise,Healthy Basics,1,2,Maintenance,,,1083,,Just breathe,Breathing exercises to improve respiratory health.,Try different breathing exercises regularly to improve your respiratory health.,,Sign up,All,weekly,6 months,24,Healthline,https://www.healthline.com/health/how-to-increase-lung-capacity,0-45,"Male, Female, Non-Conforming","Working, Retired, Not-Working","https://www.scielo.br/j/clin/a/ZRYgFMXwkPD6WRhJtLzqB3c/abstract/?lang=en, https://europepmc.org/article/med/3292262",,Healthline,Content writer,https://www.healthline.com/health/how-to-increase-lung-capacity,Online,N/A,Free,No,None,,,1.5,https://uk.trustpilot.com/review/www.healthline.com,N/A,Yearly,Gap,,,,,,,,,,,,,,,G,,,,,,,,,,,,,,,gap,,,,,,,,,,,,,,,
Health,Exercise,Healthy Basics,1,2,Development,,,1084,1085,Breathing exercises,Read about the benefits of breathing exercises.,"Breathing is something you do tens of thousands of times each day, without even thinking about it. Learn about using breathing techniques to improve your respiratory health.","Breathing exercises not only improve your respiratory health, but they can also help build strength and stamina, as well as improve general mood and wellbeing.",Read,All,,,,,,46-99,"Male, Female, Non-Conforming","Working, Retired, Not-Working","https://www.scielo.br/j/clin/a/ZRYgFMXwkPD6WRhJtLzqB3c/abstract/?lang=en, https://europepmc.org/article/med/3292262",,Regina Lawrence,Content writer,https://reginalawrence.com/2022/09/05/the-health-benefits-of-breathing-exercises-for-seniors/,Online,N/A,Free,No,None,,,N/A,N/A,N/A,Quarterly,Gap,Elderlygym,Content writer,https://eldergym.com/elderly-breathing/,Online,N/A,Free,No,None,,,N/A,N/A,N/A,Quarterly,,Harvard,Company,https://www.health.harvard.edu/staying-healthy/breathing-your-way-to-better-health,Online,N/A,Free,No,None,,,N/A,N/A,N/A,Quarterly,gap,,,,,,,,,,,,,,,
Health,Exercise,Healthy Basics,1,2,Maintenance,,,1085,,Just breathe,Breathing exercises to improve respiratory health.,Try different breathing exercises regularly to improve your respiratory health.,,Sign up,All,weekly,6 months,24,Eldergym,https://eldergym.com/elderly-breathing/,46-99,"Male, Female, Non-Conforming","Working, Retired, Not-Working","https://www.scielo.br/j/clin/a/ZRYgFMXwkPD6WRhJtLzqB3c/abstract/?lang=en, https://europepmc.org/article/med/3292262",,Eldergym,Content writer,https://eldergym.com/elderly-breathing/,Online,N/A,Free,No,None,,,N/A,N/A,N/A,Quarterly,Gap,,,,,,,,,,,,,,,,,,,,,,,,,,,,,,gap,,,,,,,,,,,,,,,
Health,Mind,Healthy Basics,1,3,Development,,,1086,,Gas safety check,Learn about the importance of carbon monoxide safety checks.,Learn about the importance of having gas safety checks and carbon monoxide detectors to keep you and your family safe.,"Carbon monoxide is an odourless and colourless gas that poses a severe health risk, as it’s highly toxic to humans. Having gas safety checks as well as a carbon monoxide detector can help keep you safe in your own home.",Read,All,,,,,,0-99,"Male, Female, Non-Conforming","Working, Retired, Not-Working",,,Parkstone Yorkshire,Content writer,https://www.parkstone-yorkshire.co.uk/safety-first-understanding-the-importance-of-a-gas-safety-check/,Online,N/A,Free,No,None,,,N/A,N/A,N/A,Quarterly,Gap,Gas Safe Register,Company,https://www.gassaferegister.co.uk/gas-safety/home-gas-safety/check-your-gas-appliances/,Online,N/A,Free,No,None,,,1.4,https://uk.trustpilot.com/review/www.gassaferegister.co.uk,N/A,Quarterly,,CM Detectors,Company,https://cmdetectors.com/blog/why-do-i-need-carbon-monoxide-detectors/,Online,N/A,Free,No,None,,,N/A,N/A,N/A,Quarterly,gap,,,,,,,,,,,,,,,
Health,Nutrition,Diagnostic,3,1,Development,,,1087,1088,Eating nuts,Eating nuts can help you live longer.,"Eating more nuts can help you live longer and have lower rates of heart disease, diabetes, and some types of cancer. Eating a handful of nuts a day can go a long way in benefitting your health.","Eating nuts as part of a healthy diet may be good for the heart. Nuts contain unsaturated fatty acids and other nutrients. They are a great inexpensive snack food, filling, easy to store and easy to pack when you're on the go.",Read,UK,,,,,,0-99,"Male, Female, Non-Conforming","Working, Retired, Not-Working","https://www.mdpi.com/2076-3921/8/8/302, https://academic.oup.com/ajcn/article/70/3/500s/4714957",,Lifetime Daily,Content writer,https://www.lifetimedaily.com/what-are-the-healthiest-nuts/,Online,N/A,Free,No,None,,,N/A,N/A,N/A,Quarterly,Gap,BBC,Company,https://www.bbcgoodfood.com/howto/guide/health-benefits-nuts,Online,N/A,Free,No,None,,,1.9,https://uk.trustpilot.com/review/www.bbcgoodfood.com,N/A,Yearly,,Nutmad,Company,https://nutmad.com/shop/healthy-snack-box-subscription/,Online,N/A,Paid,Yes(nsu),Direct,,,N/A,N/A,N/A,Quarterly,gap,Devon Hampers,Company,https://www.awin1.com/cread.php?awinmid=34051&awinaffid=1198638&ued=https%3A%2F%2Fwww.devonhampers.com%2F,Online,N/A,Paid,Approved,AWI=34051,,,4.5,https://uk.trustpilot.com/review/devonhampers.com,N/A,Yearly,
Health,Nutrition,Diagnostic,3,1,Maintenance,,,1088,,Nut subscription,Get a healthy nutty subscription box.,"With all the health benefits of eating nuts, add more nuts to your diet with a subscription service delivered straight to your door.",,Sign up,UK,weekly,6 months,24,Nutmad,https://nutmad.com/shop/healthy-snack-box-subscription/,0-99,"Male, Female, Non-Conforming","Working, Retired, Not-Working","https://www.mdpi.com/2076-3921/8/8/302, https://academic.oup.com/ajcn/article/70/3/500s/4714957",,Nutmad,Company,https://nutmad.com/shop/healthy-snack-box-subscription/,Online,N/A,Paid,Yes (NSU),Direct,,,N/A,N/A,N/A,Quarterly,Gap,,,,,,,,,,,,,,,,,,,,,,,,,,,,,,gap,,,,,,,,,,,,,,,
Health,Mind,Advanced brain & body fitness,4,2,Development,"Mental Health,Hypnotherapy",Y,1089,1090,Try hypnotherapy,Try hypnotherapy.,Try hypnotherapy to help you to relieve stress.,"Hypnotherapy, or clinical hypnosis, is a treatment where you're guided into a deeply relaxed state of highly focused awareness to affect change. On its own or in conjunction with other therapies, hypnosis has been found to be an effective treatment for chronic stress and related issues.",Visit site,UK,,,,,,0-99,"Male, Female, Non-Conforming","Working, Retired, Not-Working",http://www.ijnms.net/index.php/ijnms/article/view/8,,Hypnotherapy online,Company,https://www.hypnotherapyonline.uk/,Online,N/A,Paid,??,None,,,N/A,N/A,N/A,Quarterly,Gap,Voice,Company,https://voice-stories.app/,Online,N/A,Free,??,None,,,N/A,N/A,N/A,Quarterly,,Hypnotherapist,Company,https://www.hypnotherapists.org.uk/hypnotherapy/benefits/,Online,N/A,Free,No,None,,,N/A,N/A,N/A,Quarterly,gap,,,,,,,,,,,,,,,
Health,Mind,Advanced brain & body fitness,4,2,Maintenance,,,1090,,Find a hypnotherapist,Find a hypnotherapist in your area.,"Find a hypnotherapist for in person sessions, to help you gain all the benefits that hypnotherapy has to offer.",,Visit site,UK,weekly,6 months,24,Hypnotherapist,https://www.hypnotherapists.org.uk/therapist-finder/,0-99,"Male, Female, Non-Conforming","Working, Retired, Not-Working",http://www.ijnms.net/index.php/ijnms/article/view/8,,Hypnotherapist,Charity,https://www.hypnotherapists.org.uk/therapist-finder/,Online,N/A,Paid,No,None,,,N/A,N/A,N/A,Quarterly,Gap,,,,,,,,,,,,,,,,,,,,,,,,,,,,,,gap,,,,,,,,,,,,,,,
Health,Mind,Optimal health,5,2,Development,,,1091,1092,Mental health issues,Take a course to deepen your understanding of mental health issues,Learn about the importance of understanding mental health and wellbeing through courses to deepen understanding and empathy.,"Our mental health directly influences how we think, feel and act, it also affects our physical health. Having an understanding of mental health and wellbeing can not only impact and improve our mental health but also those who are in our lives.",Read,All,,,,,,0-99,"Male, Female, Non-Conforming","Working, Retired, Not-Working",https://link.springer.com/article/10.1186/s12888-017-1356-5,,Mental Health Courses,Charity,https://mentalhealthcourses.org.uk/,Online,N/A,Free,No,None,,,N/A,N/A,N/A,Quarterly,Gap,Learndirect,Company,https://www.learndirect.com/blog/the-importance-of-understanding-mental-health,Online,N/A,Free,No,None,,,4.7,https://uk.trustpilot.com/review/www.learndirect.com,N/A,Yearly,,Red Cross,Charity,https://blog.redcrossfirstaidtraining.co.uk/7-advantages-of-mental-health-training-that-will-help-deliver-value,Online,N/A,Free,No,None,,,4.9,https://uk.trustpilot.com/review/redcrossfirstaidtraining.co.uk,N/A,Yearly,gap,Lovendu,,https://www.awin1.com/cread.php?awinmid=25994&awinaffid=1198638&ued=https%3A%2F%2Flovendu.co.uk%2F,Online,N/A,Paid,Approved,AWIN=25994,,,4.8,https://uk.trustpilot.com/review/lovendu.co.uk,N/A,Yearly,
Health,Mind,Optimal health,5,2,Maintenance,,,1092,,Mental health course,Take a mental health course.,Sign up to take a mental health course and build a healthy understanding of improving mental health.,,Sign up,All,weekly,6 months,24,Mental Health Courses,https://mentalhealthcourses.org.uk/,0-99,"Male, Female, Non-Conforming","Working, Retired, Not-Working",https://link.springer.com/article/10.1186/s12888-017-1356-5,,Mental Health Courses,Charity,https://mentalhealthcourses.org.uk/,Online,N/A,Free,No,None,,,N/A,N/A,N/A,Quarterly,Gap,,,,,,,,,,,,,,,,,,,,,,,,,,,,,,gap,,,,,,,,,,,,,,,
Wealth,Manage,Financial security,3,3,Development,,,1093,,Trace lost money,Learn to see how you can track down any forgotten inactive accounts.,"Learn about inactive accounts, and how to see if you might have some extra money stashed away somewhere.","In the UK, there are millions of pounds in inactive accounts that remain unclaimed. Learn about how to check to see if you have any dormant bank accounts, pensions, insurance policies or premium bonds.",Read,UK,,,,,,0-59,"Male, Female, Non-Conforming","Working, Retired, Not-Working",N/A,,Which?,Company,https://www.which.co.uk/money/savings-and-isas/savings-accounts/how-to-find-lost-bank-and-savings-accounts-aU2w07j7905s,Online,N/A,Free,No,None,,,1.6,https://www.trustpilot.com/review/www.which.co.uk,n/a,6 monthly,Gap,MoneySavingExpert.com,Company,https://www.moneysavingexpert.com/reclaim/reclaim-lost-assets-free/,Online,N/A,Free,No,None,,,2,https://uk.trustpilot.com/review/www.moneysavingexpert.com,N/A,Yearly,,Age UK,Charity,https://www.ageuk.org.uk/information-advice/money-legal/debt-savings/how-to-trace-lost-money/,Online,N/A,Free,No,None,,,1.5,https://uk.trustpilot.com/review/ageuk.co.uk,N/A,Yearly,gap,,,,,,,,,,,,,,,
